{
  "$schema": "https://json-schema.org/draft/2020-12/schema",
  "$id": "https://schemas.aelion.dev/material/definition/v1.json",
  "title": "Aelion Material Definition v1",
  "type": "object",
  "additionalProperties": false,
  "required": [
    "$schema",
    "protocolVersion",
    "id",
    "kind",
    "display",
    "scopes",
    "ports",
    "parameters",
    "bundledResources",
    "resourceSlots",
    "execution",
    "implementations",
    "splitPolicy"
  ],
  "properties": {
    "$schema": {
      "const": "https://schemas.aelion.dev/material/definition/v1.json"
    },
    "protocolVersion": {
      "const": "1.0.0"
    },
    "id": {
      "$ref": "#/$defs/identifier"
    },
    "kind": {
      "enum": [
        "visual-filter",
        "visual-effect",
        "visual-transition",
        "visual-generator"
      ]
    },
    "display": {
      "$ref": "#/$defs/display"
    },
    "scopes": {
      "type": "array",
      "minItems": 1,
      "uniqueItems": true,
      "items": {
        "enum": ["source", "item", "track", "sequence", "transition"]
      }
    },
    "ports": {
      "type": "array",
      "minItems": 1,
      "maxItems": 16,
      "items": {
        "$ref": "#/$defs/port"
      }
    },
    "parameters": {
      "type": "array",
      "maxItems": 64,
      "items": {
        "$ref": "#/$defs/parameter"
      }
    },
    "bundledResources": {
      "type": "array",
      "maxItems": 32,
      "items": {
        "$ref": "#/$defs/bundledResource"
      }
    },
    "resourceSlots": {
      "type": "array",
      "maxItems": 16,
      "items": {
        "$ref": "#/$defs/resourceSlot"
      }
    },
    "execution": {
      "$ref": "#/$defs/execution"
    },
    "implementations": {
      "type": "array",
      "minItems": 1,
      "maxItems": 8,
      "items": {
        "$ref": "#/$defs/implementation"
      }
    },
    "splitPolicy": {
      "enum": ["copy", "reset", "reject"]
    }
  },
  "$defs": {
    "identifier": {
      "type": "string",
      "minLength": 1,
      "maxLength": 96,
      "pattern": "^[A-Za-z][A-Za-z0-9_-]*$"
    },
    "relativePath": {
      "type": "string",
      "minLength": 1,
      "maxLength": 512,
      "pattern": "^(?!/)(?!.*(?:^|/)\\.\\.(?:/|$))(?!.*\\\\)[^\\u0000]+$"
    },
    "jsonValue": {
      "oneOf": [
        { "type": "null" },
        { "type": "boolean" },
        { "type": "number" },
        { "type": "string", "maxLength": 4096 },
        {
          "type": "array",
          "maxItems": 1024,
          "items": { "$ref": "#/$defs/jsonValue" }
        },
        {
          "type": "object",
          "maxProperties": 128,
          "additionalProperties": { "$ref": "#/$defs/jsonValue" }
        }
      ]
    },
    "display": {
      "type": "object",
      "additionalProperties": false,
      "required": ["name"],
      "properties": {
        "name": { "type": "string", "minLength": 1, "maxLength": 128 },
        "description": { "type": "string", "maxLength": 2048 },
        "category": { "type": "string", "maxLength": 64 },
        "tags": {
          "type": "array",
          "maxItems": 32,
          "uniqueItems": true,
          "items": { "type": "string", "minLength": 1, "maxLength": 64 }
        },
        "icon": { "$ref": "#/$defs/relativePath" },
        "thumbnail": { "$ref": "#/$defs/relativePath" },
        "preview": { "$ref": "#/$defs/relativePath" },
        "localizationPrefix": { "type": "string", "maxLength": 128 }
      }
    },
    "port": {
      "type": "object",
      "additionalProperties": false,
      "required": ["id", "direction", "type", "role", "binding", "required"],
      "properties": {
        "id": { "$ref": "#/$defs/identifier" },
        "direction": { "enum": ["input", "output"] },
        "type": { "enum": ["visual-frame", "mask", "depth", "motion-vectors"] },
        "role": { "enum": ["source", "from", "to", "auxiliary", "result"] },
        "binding": { "enum": ["host", "instance"] },
        "required": { "type": "boolean" },
        "description": { "type": "string", "maxLength": 512 }
      }
    },
    "parameter": {
      "type": "object",
      "additionalProperties": false,
      "required": ["id", "type", "default", "animatable", "affects", "ui"],
      "properties": {
        "id": { "$ref": "#/$defs/identifier" },
        "type": {
          "enum": [
            "boolean", "integer", "float", "enum", "vec2", "vec3", "vec4",
            "color", "angle", "duration", "gradient", "curve", "string"
          ]
        },
        "default": { "$ref": "#/$defs/jsonValue" },
        "range": {
          "type": "object",
          "additionalProperties": false,
          "properties": {
            "min": { "type": "number" },
            "max": { "type": "number" },
            "softMin": { "type": "number" },
            "softMax": { "type": "number" },
            "step": { "type": "number", "exclusiveMinimum": 0 }
          }
        },
        "values": {
          "type": "array",
          "minItems": 1,
          "uniqueItems": true,
          "items": { "type": "string", "minLength": 1, "maxLength": 96 }
        },
        "unit": {
          "enum": ["none", "ratio", "percent", "px", "degree", "us", "db", "hz"]
        },
        "animatable": { "type": "boolean" },
        "interpolation": {
          "enum": ["hold", "linear", "cubic-bezier", "shortest-angle", "linear-color"]
        },
        "affects": { "enum": ["uniform", "specialization", "graph"] },
        "ui": {
          "type": "object",
          "additionalProperties": false,
          "required": ["control", "group", "order", "label"],
          "properties": {
            "control": {
              "enum": ["toggle", "slider", "number", "select", "segmented", "color", "point", "curve", "gradient", "text"]
            },
            "group": { "type": "string", "maxLength": 96 },
            "order": { "type": "integer" },
            "label": { "type": "string", "minLength": 1, "maxLength": 128 }
          }
        }
      }
    },
    "bundledResource": {
      "type": "object",
      "additionalProperties": true,
      "required": ["id", "kind", "path"],
      "properties": {
        "id": { "$ref": "#/$defs/identifier" },
        "kind": { "enum": ["texture2d", "texture3d", "lut1d", "lut3d", "cube-texture", "mask", "binary-table"] },
        "path": { "$ref": "#/$defs/relativePath" }
      }
    },
    "resourceSlot": {
      "type": "object",
      "additionalProperties": true,
      "required": ["id", "kind", "required"],
      "properties": {
        "id": { "$ref": "#/$defs/identifier" },
        "kind": { "enum": ["texture2d", "texture3d", "lut1d", "lut3d", "cube-texture", "mask", "binary-table"] },
        "required": { "type": "boolean" },
        "fallbackResourceId": { "$ref": "#/$defs/identifier" }
      }
    },
    "execution": {
      "type": "object",
      "additionalProperties": false,
      "required": ["color", "alpha", "resolution", "spatialPadding", "temporal", "determinism", "supports"],
      "properties": {
        "color": {
          "type": "object",
          "additionalProperties": false,
          "required": ["input", "output"],
          "properties": {
            "input": { "const": "working-linear" },
            "output": { "const": "working-linear" }
          }
        },
        "alpha": {
          "type": "object",
          "additionalProperties": false,
          "required": ["input", "output", "preservesTransparency"],
          "properties": {
            "input": { "const": "premultiplied" },
            "output": { "const": "premultiplied" },
            "preservesTransparency": { "type": "boolean" }
          }
        },
        "resolution": {
          "type": "object",
          "additionalProperties": false,
          "required": ["policy"],
          "properties": {
            "policy": { "enum": ["same-as-host", "scale"] },
            "scale": { "type": "number", "exclusiveMinimum": 0, "maximum": 4 },
            "minimum": {
              "type": "object",
              "additionalProperties": false,
              "required": ["width", "height"],
              "properties": {
                "width": { "type": "integer", "minimum": 1, "maximum": 16384 },
                "height": { "type": "integer", "minimum": 1, "maximum": 16384 }
              }
            }
          }
        },
        "spatialPadding": {
          "type": "object",
          "additionalProperties": false,
          "required": ["mode"],
          "properties": {
            "mode": { "enum": ["none", "fixed", "parameter-bound"] },
            "pixels": { "type": "number", "minimum": 0, "maximum": 4096 },
            "parameter": { "$ref": "#/$defs/identifier" },
            "maximumPixels": { "type": "number", "minimum": 0, "maximum": 4096 }
          }
        },
        "temporal": {
          "type": "object",
          "additionalProperties": false,
          "required": ["pastUs", "futureUs", "stateful", "seekPolicy"],
          "properties": {
            "pastUs": { "type": "integer", "minimum": 0 },
            "futureUs": { "type": "integer", "minimum": 0 },
            "stateful": { "type": "boolean" },
            "seekPolicy": { "enum": ["stateless", "reconstruct", "reset-with-warning"] }
          }
        },
        "determinism": { "enum": ["strict", "backend-tolerant", "non-deterministic"] },
        "supports": {
          "type": "object",
          "additionalProperties": false,
          "required": ["realtime", "offline", "alpha", "hdr", "tiled"],
          "properties": {
            "realtime": { "type": "boolean" },
            "offline": { "type": "boolean" },
            "alpha": { "type": "boolean" },
            "hdr": { "type": "boolean" },
            "tiled": { "type": "boolean" }
          }
        }
      }
    },
    "implementation": {
      "oneOf": [
        {
          "type": "object",
          "additionalProperties": false,
          "required": ["type", "graph", "nodeSet"],
          "properties": {
            "type": { "const": "graph" },
            "graph": { "$ref": "#/$defs/relativePath" },
            "nodeSet": { "type": "string", "minLength": 1, "maxLength": 128 }
          }
        },
        {
          "type": "object",
          "additionalProperties": true,
          "required": ["type", "backend", "abi", "entryPoint"],
          "properties": {
            "type": { "const": "shader" },
            "backend": { "enum": ["webgpu", "webgl2"] },
            "abi": { "enum": ["aelion-material-shader/1", "aelion-material-webgl/1"] },
            "entryPoint": { "type": "string", "minLength": 1, "maxLength": 128 }
          }
        },
        {
          "type": "object",
          "additionalProperties": true,
          "required": ["type", "module", "abi"],
          "properties": {
            "type": { "const": "wasm" },
            "module": { "$ref": "#/$defs/relativePath" },
            "abi": { "const": "aelion-material-wasm/1" }
          }
        }
      ]
    }
  }
}
